### ISSUE TITLE
Proxy protocol: front parsing error on the second sozu in chain (expect_proxy = true)

### ISSUE THREAD

**Issue by BlackYoup** [sozu-proxy/sozu#493]
Setup: two sozu: one with a TCP front that sends the proxy protocol header, the second with an HTTP front and an application that has the `expect_proxy = true` option.

The first sozu sends the request and the second sozu closes the connection because it has a `front parsing error`.

Configurations:
TCP sozu: https://gist.github.com/BlackYoup/16e4611f6ca7b369db7a1dae89c7d63b
HTTP sozu: https://gist.github.com/BlackYoup/9a246af0c4bcabaf7b065055d048d9c3

Logs:
TCP sozu: https://gist.github.com/BlackYoup/74092e063144bb7faf984e80667fa28e
HTTP sozu: https://gist.github.com/BlackYoup/8d2925c5217a0a2c72a6dd055b9ff058

Reproduce: `curl lolcatho.st:8080` will give:
```
~ $ curl lolcatho.st:8080 -v
* Rebuilt URL to: lolcatho.st:8080/
*   Trying 127.0.0.1...
* TCP_NODELAY set
* Connected to lolcatho.st (127.0.0.1) port 8080 (#0)
> GET / HTTP/1.1
> Host: lolcatho.st:8080
> User-Agent: curl/7.60.0
> Accept: */*
>
* Empty reply from server
* Connection #0 to host lolcatho.st left intact
curl: (52) Empty reply from server
```

tcpdump:
```
13:42:43.937699 IP 127.0.0.1.40330 > 127.0.0.1.8080: Flags [S], seq 3984313787, win 43690, options [mss 65495,sackOK,TS val 3247502712 ecr 0,nop,wscale 7], length 0                                                                                          
13:42:43.937708 IP 127.0.0.1.8080 > 127.0.0.1.40330: Flags [S.], seq 1835518306, ack 3984313788, win 43690, options [mss 65495,sackOK,TS val 3247502712 ecr 3247502712,nop,wscale 7], length 0                                                                
13:42:43.937716 IP 127.0.0.1.40330 > 127.0.0.1.8080: Flags [.], ack 1, win 342, options [nop,nop,TS val 3247502712 ecr 3247502712], length 0                                                                                                                  
13:42:43.937760 IP 127.0.0.1.40330 > 127.0.0.1.8080: Flags [P.], seq 1:81, ack 1, win 342, options [nop,nop,TS val 3247502712 ecr 3247502712], length 80: HTTP: GET / HTTP/1.1                                                                                
13:42:43.937939 IP 127.0.0.1.38702 > 127.0.0.1.8081: Flags [S], seq 893673235, win 43690, options [mss 65495,sackOK,TS val 3247502712 ecr 0,nop,wscale 7], length 0                                                                                           
13:42:43.937948 IP 127.0.0.1.8081 > 127.0.0.1.38702: Flags [S.], seq 4245148143, ack 893673236, win 43690, options [mss 65495,sackOK,TS val 3247502712 ecr 3247502712,nop,wscale 7], length 0                                                                 
13:42:43.937954 IP 127.0.0.1.38702 > 127.0.0.1.8081: Flags [.], ack 1, win 342, options [nop,nop,TS val 3247502712 ecr 3247502712], length 0                                                                                                                  
13:42:43.938120 IP 127.0.0.1.38702 > 127.0.0.1.8081: Flags [P.], seq 1:29, ack 1, win 342, options [nop,nop,TS val 3247502712 ecr 3247502712], length 28                                                                                                      
13:42:43.938126 IP 127.0.0.1.8081 > 127.0.0.1.38702: Flags [.], ack 29, win 342, options [nop,nop,TS val 3247502712 ecr 3247502712], length 0                                                                                                                 
13:42:43.938232 IP 127.0.0.1.38702 > 127.0.0.1.8081: Flags [P.], seq 29:109, ack 1, win 342, options [nop,nop,TS val 3247502712 ecr 3247502712], length 80                                                                                                    
13:42:43.938236 IP 127.0.0.1.8081 > 127.0.0.1.38702: Flags [.], ack 109, win 342, options [nop,nop,TS val 3247502712 ecr 3247502712], length 0                                                                                                                
13:42:43.938265 IP 127.0.0.1.8081 > 127.0.0.1.38702: Flags [F.], seq 1, ack 109, win 342, options [nop,nop,TS val 3247502712 ecr 3247502712], length 0                                                                                                        
13:42:43.938314 IP 127.0.0.1.8081 > 127.0.0.1.38702: Flags [R.], seq 2, ack 109, win 342, options [nop,nop,TS val 3247502712 ecr 3247502712], length 0                                                                                                        
13:42:43.938398 IP 127.0.0.1.8080 > 127.0.0.1.40330: Flags [F.], seq 1, ack 81, win 342, options [nop,nop,TS val 3247502713 ecr 3247502712], length 0                                                                                                         
13:42:43.938487 IP 127.0.0.1.40330 > 127.0.0.1.8080: Flags [F.], seq 81, ack 2, win 342, options [nop,nop,TS val 3247502713 ecr 3247502713], length 0                                                                                                         
13:42:43.938494 IP 127.0.0.1.8080 > 127.0.0.1.40330: Flags [.], ack 82, win 342, options [nop,nop,TS val 3247502713 ecr 3247502713], length 0                               
```

**Comment by Geal** [comment]
the `expect_proxy` option should be under `[http]`, `[https]` or `[tcp]`, since that will affect all applications accessible through the same port. Should there be a warning if the `expect_proxy` option is in the wrong place.

**Comment by BlackYoup** [comment]
Ooh, yes, makes sense.. for [tcp], it's per application (or at least, that's how it is in the bin/config.toml) file. That's why I put it in the HTTP application too
