### ISSUE TITLE
Workers don't correctly detect closed connections and try to reuse them

### ISSUE THREAD

**Issue by BlackYoup** [sozu-proxy/sozu#205]
I mostly open this issue to track it, I'll try to go deeper into why it behaves like this but right now, I don't have much clues.

I'm using sozu in front of a plex instance (plex being a self hosted netflix like). During video streaming, some requests hang and never complete. I have only 1 backend and 1 worker.

I don't really know from where this comes from. With haproxy in front of the plex instance, I can't reproduce the problem.

The last logs after a browser refresh, when the index.html page hangs:
```
2017-07-31T22:27:18Z    1219171966852505        8556    DEBUG   TAG-0   sozu_lib::network::protocol::http       b573d867-b590-48d8-82fa-1368ea8d5251    plex            FRONT [Some(Token(6148914691236517219))]: read 492 bytes
2017-07-31T22:27:18Z    1219171967105692        8556    TRACE   TAG-0   sozu_lib::parser::http11        PARSER  got Connection header: ""keep-alive""
2017-07-31T22:27:18Z    1219171967422359        8556    TRACE   TAG-0   sozu_lib::network::session      front readable  interpreting client order ConnectBackend
2017-07-31T22:27:18Z    1219171967500568        8556    DEBUG   TAG-0   sozu_lib::network::session      keepalive, reusing backend connection
2017-07-31T22:27:18Z    1219171967637816        8556    DEBUG   TAG-0   sozu_lib::network::protocol::http       b573d867-b590-48d8-82fa-1368ea8d5251    plex            BACK [6148914691236517219->6148914691236517718]: wrote 628 bytes of 628
2017-07-31T22:27:18Z    1219171967676536        8556    DEBUG   TAG-0   sozu_lib::network::protocol::http       b573d867-b590-48d8-82fa-1368ea8d5251    plex            BACK  [6148914691236517219<-6148914691236517718]: read 0 bytes
2017-07-31T22:27:18Z    1219171967731555        8556    TRACE   TAG-0   sozu_lib::network::session      front writable  interpreting client order Continue
```

This is not much context. It's just one request that hangs and some other still complete fine (not much though). Reloading the page doesn't help.

To elaborate on the "other requests still complete fine":
- I stream a movie
- The request downloading the video stream hangs at some point (it's one request only). 
- I refresh the page, all assets do not load, some of them hang
- If I keep refreshing, more and more requests will hang until the index.html file hangs too (with the logs above)
- If I wait a few minutes (or even a few seconds) and refresh, everything is back to normal

Maybe it's the keep-alive between the proxy and the backend ? It's easy to reproduce but sometimes it takes 1 minute, some other times it takes 10 minutes.

I'll try to tcpdump this.

**Comment by BlackYoup** [comment]
So, I don't know if this is related, but I can see that there are some connections in `CLOSE_WAIT` state between sozu and the backend (which listens on port 32400).

lsof output

```
sozu      31311                   root   11u     IPv4           35464616        0t0        TCP localhost:44584->localhost:32400 (CLOSE_WAIT)                                                      
sozu      31311                   root   18u     IPv4           35463743        0t0        TCP localhost:44588->localhost:32400 (CLOSE_WAIT)                                                      
sozu      31311                   root   19u     IPv4           35469346        0t0        TCP localhost:44592->localhost:32400 (CLOSE_WAIT)                                                      
sozu      31311                   root   20u     IPv4           35468438        0t0        TCP localhost:44596->localhost:32400 (ESTABLISHED)                                                     
sozu      31311                   root   25u     IPv4           35465721        0t0        TCP localhost:44822->localhost:32400 (CLOSE_WAIT)                                                      
sozu      31311                   root   29u     IPv4           35465724        0t0        TCP localhost:44826->localhost:32400 (CLOSE_WAIT)                                                      
sozu      31311                   root   36u     IPv4           35465726        0t0        TCP localhost:44840->localhost:32400 (CLOSE_WAIT)                                                      
sozu      31311                   root   37u     IPv4           35465727        0t0        TCP localhost:44844->localhost:32400 (ESTABLISHED)                                                     
sozu      31311                   root   38u     IPv4           35465731        0t0        TCP localhost:44848->localhost:32400 (CLOSE_WAIT)                                                      
sozu      31311                   root   47u     IPv4           35657115        0t0        TCP localhost:47796->localhost:32400 (ESTABLISHED)                                                     
sozu      31311                   root   48u     IPv4           35657116        0t0        TCP localhost:47800->localhost:32400 (ESTABLISHED)                                                     
sozu      31311                   root   49u     IPv4           35657117        0t0        TCP localhost:47804->localhost:32400 (ESTABLISHED)                                                     
sozu      31311                   root   50u     IPv4           35573348        0t0        TCP localhost:47808->localhost:32400 (ESTABLISHED)    
```

I'm not sure either why there are so much `ESTABLISHED` connections ?

**Comment by Geal** [comment]
you should uncomment those lines:
https://github.com/sozu-proxy/sozu/blob/master/lib/src/parser/http11.rs#L1387
https://github.com/sozu-proxy/sozu/blob/master/lib/src/parser/http11.rs#L1477

Maybe the proxy reaches a state where it does not do anything anymore, while it should.
Do you have a dump of the request and response?

**Comment by BlackYoup** [comment]
Okay, so here's more details.

I waited for the video stream to hang and refresh the page. One asset got stuck during the refresh. I checked my tcpdump output and noticed that the request used a socket that has been closed by the backend:

```
14:06:40.436499 IP localhost.32400 > localhost.49588: Flags [P.], seq 6467:6987, ack 1787, win 392, options [nop,nop,TS val 2201936672 ecr 2201936667], length 520
14:06:40.436530 IP localhost.49588 > localhost.32400: Flags [.], ack 6987, win 1466, options [nop,nop,TS val 2201936672 ecr 2201936672], length 0
14:07:00.437551 IP localhost.32400 > localhost.49588: Flags [F.], seq 6987, ack 1787, win 392, options [nop,nop,TS val 2201956673 ecr 2201936672], length 0
14:07:00.478459 IP localhost.49588 > localhost.32400: Flags [.], ack 6988, win 1466, options [nop,nop,TS val 2201956714 ecr 2201956673], length 0
14:08:38.200698 IP localhost.49588 > localhost.32400: Flags [P.], seq 1787:1879, ack 6988, win 1466, options [nop,nop,TS val 2202054436 ecr 2201956673], length 92
14:08:38.241422 IP localhost.32400 > localhost.49588: Flags [.], ack 1879, win 392, options [nop,nop,TS val 2202054477 ecr 2202054436], length 0
14:08:38.241443 IP localhost.49588 > localhost.32400: Flags [P.], seq 1879:2342, ack 6988, win 1466, options [nop,nop,TS val 2202054477 ecr 2202054477], length 463
14:08:38.241465 IP localhost.32400 > localhost.49588: Flags [.], ack 2342, win 400, options [nop,nop,TS val 2202054477 ecr 2202054477], length 0
```

You can see the FIN here at `14:07:00.437551` and sozu transmitting the request of that asset at `14:08:38.200698`
Right after, there is another `PUSH` from sozu, but it won't receive the expected answer.

`lsof` shows the socket in `CLOSE_WAIT` state:
```
exherbo-dedicated home # lsof 2>/dev/null | grep 49588                                           
sozu      18505                   root   28u     IPv4           37053200        0t0        TCP localhost:49588->localhost:32400 (CLOSE_WAIT)
```

**Comment by BlackYoup** [comment]
I've updated the title. The video stream hanging at some point is not the same issue

**Comment by BlackYoup** [comment]
All of this led me to this line: https://github.com/sozu-proxy/sozu/blob/22e806136d2244f6fe939aad25d4d2a3850538ce/lib/src/network/session.rs#L544

When the backend sends a FIN packet, the proxy receives a `Ready {Readable | Writable | Hup}` event but the checks above returns false while, to me, it should return true. `self.clients[client_token].front_hup()` returns `ClientResult::Continue` and we never close the socket.

**Comment by Geal** [comment]
oh, right. Try replacing `front_hup` by `back_hup` on this line? I think that's the bug

**Comment by BlackYoup** [comment]
I tried, the problem remains the same and still return `ClientResult::Continue`

The thing is, `back_hup()` checks if `Client::token` is `None` to know if we should continue or close. But I couldn't find where `Client::token` is set to `None.

https://github.com/sozu-proxy/sozu/blob/22e806136d2244f6fe939aad25d4d2a3850538ce/lib/src/network/http.rs#L231..L245

`front_hup()` checks for `backend_token` being `None` but the only place it is set to `None` is when we remove the backend, in `Client::remove_backend()`

https://github.com/sozu-proxy/sozu/blob/master/lib/src/network/http.rs#L222..L229

**Comment by BlackYoup** [comment]
It works fine now, connections are closed when a FIN packet has been sent by the backend !
